{
  "schema_version": "3A.1",
  "id": "planter_prisma_rectangular_basico_001",
  "product_kind": "planter",
  "source": {
    "kind": "prompt",
    "prompt": "Haz una maceta funcional con cuerpo de prisma rectangular horizontal, hueca, abierta arriba y con drenaje inferior. Sin texto, sin decoración y sin patrones.",
    "image_reference": null
  },
  "body": {
    "family": "organic",
    "height_mm": 120.0,
    "width_mm": 200.0,
    "depth_mm": 150.0,
    "opening_shape": "polygonal",
    "opening_width_ratio": 0.95,
    "opening_depth_ratio": 0.95,
    "style_tags": ["rectangular_prism"]
  },
  "features": [],
  "relations": [],
  "manufacturing": {
    "minimum_wall_mm": 3.0,
    "minimum_feature_mm": 1.0,
    "maximum_relief_depth_mm": 1.0,
    "drainage_required": true,
    "multicolor_requested": false
  },
  "assumptions": [
    {"field_path":"body.height_mm","selected_value":"120","reason":"Validated primitive benchmark dimension","confidence":0.8,"requires_confirmation":true},
    {"field_path":"body.width_mm","selected_value":"200","reason":"Validated primitive benchmark dimension","confidence":0.8,"requires_confirmation":true},
    {"field_path":"body.depth_mm","selected_value":"150","reason":"Validated primitive benchmark dimension","confidence":0.8,"requires_confirmation":true},
    {"field_path":"body.opening_shape","selected_value":"polygonal","reason":"Rectangular planter opening","confidence":1.0,"requires_confirmation":false},
    {"field_path":"body.opening_width_ratio","selected_value":"0.95","reason":"Validated primitive benchmark opening ratio","confidence":0.9,"requires_confirmation":true},
    {"field_path":"body.opening_depth_ratio","selected_value":"0.95","reason":"Validated primitive benchmark opening ratio","confidence":0.9,"requires_confirmation":true}
  ],
  "ambiguities": []
}
